Rank;Sourceid;Title;Type;Issn;SJR;SJR Best Quartile;H index;Total Docs. (2017);Total Docs. (3years);Total Refs.;Total Cites (3years);Citable Docs. (3years);Cites / Doc. (2years);Ref. / Doc.;Country;Publisher;Categories
360;18707;"Proceedings - International Symposium on Computers and Communications";conference and proceedings;"15301346";0,193;-;40;223;565;4232;505;555;0,89;18,98;Brazil;"";"Computer Networks and Communications; Computer Science Applications; Mathematics (miscellaneous); Signal Processing; Software"
361;12300154905;"Revista Fitotecnia Mexicana";journal;"01877380";0,192;Q4;11;55;148;2036;54;137;0,37;37,02;Mexico;"Sociedad Mexicana de Fitogenetica";"Agronomy and Crop Science (Q4); Genetics (Q4); Horticulture (Q4); Plant Science (Q4)"
362;19700166903;"Universitas Scientiarum";journal;"01227483";0,192;Q3;7;10;65;384;37;64;0,63;38,40;Colombia;"Pontificia Universidad Javeriana";"Multidisciplinary (Q3)"
363;19400157235;"Revista Colombiana de Ciencias Pecuarias";journal;"01200690, 22562958";0,192;Q3;10;59;104;1417;36;92;0,37;24,02;Colombia;"Universidad de Antioquia";"Veterinary (miscellaneous) (Q3); Animal Science and Zoology (Q4)"
364;5800156831;"RLA, Revista de linguistica teorica y aplicada";journal;"0033698X";0,192;Q2;8;16;48;605;16;42;0,33;37,81;Chile;"Facultad de Educacion, Humanidades y Arte, Universidad de Concepcion";"Language and Linguistics (Q2); Linguistics and Language (Q2); Education (Q3)"
365;21100464746;"Fronteiras";journal;"22388869";0,192;Q3;1;67;103;2172;11;96;0,11;32,42;Brazil;"University Center Annapolis";"Environmental Science (miscellaneous) (Q3); Social Sciences (miscellaneous) (Q3)"
366;19900191876;"Transinformacao";journal;"01033786";0,192;Q2;4;31;88;992;28;83;0,27;32,00;Brazil;"Pontificia Universidade Catolica de Campinas";"Museology (Q2); Communication (Q3); Library and Information Sciences (Q3); Information Systems (Q4)"
367;5000158304;"Revista Cubana de Obstetricia y Ginecologia";journal;"0138600X";0,191;Q3;9;44;150;927;13;143;0,05;21,07;Cuba;"Editorial Ciencias Medicas";"Obstetrics and Gynecology (Q3)"
368;145262;"Journal of the Brazilian Computer Society";journal;"01046500";0,190;Q3;15;15;48;726;31;48;0,67;48,40;Brazil;"Springer International Publishing AG";"Computer Science (miscellaneous) (Q3)"
369;21100199541;"Revista Brasileira de Medicina do Trabalho";journal;"16794435";0,189;Q4;4;50;82;1195;25;78;0,35;23,90;Brazil;"Associacao Nacional de Medicina do Trabalho";"Physiology (medical) (Q4)"
370;19700173003;"Ingenieria e Investigacion";journal;"22488723, 01205609";0,189;Q3;7;44;149;1179;83;141;0,60;26,80;Colombia;"Universidad Nacional De Colombia";"Engineering (miscellaneous) (Q3)"
371;10900153310;"Psicologia Clinica";journal;"01035665, 19805438";0,189;Q4;6;0;43;0;7;40;0,43;0,00;Brazil;"Pontificia Universidade Catolica do Rio de Janeiro";"Clinical Psychology (Q4); Psychiatry and Mental Health (Q4)"
372;7500153128;"Universitas Psychologica";journal;"16579267";0,189;Q4;17;121;335;5335;129;326;0,33;44,09;Colombia;"Pontificia Universidad Javeriana";"Psychology (miscellaneous) (Q4); Social Psychology (Q4)"
373;145734;"Boletim de Ciencias Geodesicas";journal;"14134853";0,188;Q3;7;44;155;1170;44;155;0,24;26,59;Brazil;"Universidade Federal do Parana";"Earth and Planetary Sciences (miscellaneous) (Q3)"
374;21100820898;"Tropical Grasslands - Forrajes Tropicales";journal;"23463775";0,188;Q4;7;15;108;597;47;108;0,50;39,80;Colombia;"Centro Internacional de Agricultura Tropical (CIAT)";"Agronomy and Crop Science (Q4); Ecology, Evolution, Behavior and Systematics (Q4); Plant Science (Q4)"
375;17700155039;"Revista Materia";journal;"15177076";0,188;Q3;10;177;258;4217;120;242;0,42;23,82;Brazil;"Universidade Federal do Rio de Janeiro, Coordenacao dos Programas de Pos-Graduacao em Engenharia";"Chemistry (miscellaneous) (Q3); Materials Science (miscellaneous) (Q3); Physics and Astronomy (miscellaneous) (Q4)"
376;21100258911;"Izquierdas";journal;"07185049";0,188;Q2;2;69;153;2668;23;153;0,15;38,67;Chile;"Universidad de Santiago de Chile";"History (Q2); Political Science and International Relations (Q3); Sociology and Political Science (Q3)"
377;12100155657;"Mundo Agrario";journal;"15155994";0,187;Q3;5;33;110;1351;18;109;0,16;40,94;Argentina;"Universidad Nacional de La Plata";"Agricultural and Biological Sciences (miscellaneous) (Q3); Geography, Planning and Development (Q3); Industrial Relations (Q3); Urban Studies (Q3)"
378;5000159706;"Revista Electronica de Investigacion Educativa";journal;"16074041";0,187;Q4;7;52;113;1427;31;110;0,24;27,44;Mexico;"Instituto de Investigacion y Desarrollo Educativo de la Universidad Autonoma de Baja California";"Education (Q4)"
379;19400157227;"AgriScientia";journal;"03276244";0,187;Q4;6;16;34;590;21;34;0,26;36,88;Argentina;"Universidad Nacional de Cordoba";"Agronomy and Crop Science (Q4); Soil Science (Q4)"
380;4700151716;"Ceramica";journal;"03666913";0,186;Q4;14;73;218;2177;90;200;0,40;29,82;Brazil;"Associacao Brasileiro de Ceramica";"Ceramics and Composites (Q4)"
381;20500195026;"International Journal of High Dilution Research";journal;"19826206";0,186;Q3;6;5;94;83;13;80;0,10;16,60;Brazil;"Universidade Estadual Paulista - UNESP";"Complementary and Alternative Medicine (Q3)"
382;19917;"Revista Brasileira de Medicina do Esporte";journal;"15178692";0,185;Q3;23;91;258;2637;85;253;0,27;28,98;Brazil;"Redprint Editora Ltda.";"Physical Therapy, Sports Therapy and Rehabilitation (Q3); Orthopedics and Sports Medicine (Q4); Sports Science (Q4)"
383;19700174720;"Revista Colombiana de Entomologia";journal;"01200488";0,184;Q4;14;21;127;700;39;120;0,18;33,33;Colombia;"Editora Guadalupe Ltda.";"Insect Science (Q4)"
384;14512;"Archivos Argentinos de Pediatria";journal;"00040487";0,184;Q3;16;192;782;3408;193;528;0,38;17,75;Argentina;"Sociedad Argentina de Pediatria";"Pediatrics, Perinatology and Child Health (Q3)"
385;80799;"Revista Geografica Venezolana";journal;"10121617";0,183;Q3;8;29;66;724;9;52;0,25;24,97;Venezuela;"Universidad de los Andes";"Earth-Surface Processes (Q3); Geography, Planning and Development (Q3)"
386;21100264366;"Revista Brasileira de Ciencias do Esporte";journal;"21793255, 01013289";0,183;Q3;4;64;183;1586;41;173;0,23;24,78;Brazil;"Colegio Brasileiro de Ciencias do Esporte (CBCE)";"Physical Therapy, Sports Therapy and Rehabilitation (Q3); Health (social science) (Q4)"
387;5600152973;"Analisis Politico";journal;"01214705";0,183;Q2;5;28;114;1124;16;112;0,12;40,14;Colombia;"Universidad Nacional de Colombia";"History (Q2); Political Science and International Relations (Q3); Sociology and Political Science (Q3)"
388;4700152714;"Cadernos de Pesquisa";journal;"01001574";0,183;Q2;12;61;165;2279;32;145;0,17;37,36;Brazil;"Fundacao Carlos Chagas";"Cultural Studies (Q2); Gender Studies (Q3); Education (Q4)"
389;145190;"Online Brazilian Journal of Nursing";journal;"16764285";0,183;Q3;8;23;259;427;38;251;0,11;18,57;Brazil;"Fluminense Federal University";"Nursing (miscellaneous) (Q3)"
390;22962;"Interciencia";journal;"03781844";0,183;Q3;30;96;381;3087;111;348;0,28;32,16;Venezuela;"Interciencia Association";"Multidisciplinary (Q3)"
391;20156;"Revista Alergia Mexico";journal;"00025151";0,183;Q4;12;0;48;0;15;46;0,20;0,00;Mexico;"Sociedad Mexicana de Alergia e Inmunologia";"Immunology and Allergy (Q4)"
392;21100790352;"Revista do Instituto Geologico";journal;"21761892, 0100929X";0,182;Q4;1;5;10;212;7;10;0,70;42,40;Brazil;"Instituto Geologico, Secretaria do Meio Ambiente";"Geology (Q4)"
393;19700174746;"Custos e Agronegocio";journal;"18082882";0,182;Q3;4;95;210;3234;33;207;0,15;34,04;Brazil;"Universidade Federal Rural de Pernambuco";"Business, Management and Accounting (miscellaneous) (Q3); Agronomy and Crop Science (Q4)"
394;21100200407;"Arqueologia";journal;"03275159";0,182;Q2;4;25;68;1025;13;64;0,23;41,00;Argentina;"Facultad de Filosofia y Letras, Universidad de Buenos Aires";"Archeology (Q2); Archeology (arts and humanities) (Q2)"
395;21100235613;"ACDI Anuario Colombiano de Derecho Internacional";journal;"20271131";0,181;Q3;1;16;26;406;1;22;0,06;25,38;Colombia;"Asociacion Cavelier Del Derecho, Universidad del Rosario";"Law (Q3)"
396;21100202945;"Tempo e Argumento";journal;"21751803";0,181;Q2;4;52;137;1557;14;123;0,04;29,94;Brazil;"Universidade Do Estado de Santa Catarina";"History (Q2)"
397;19700186889;"Revista Brasileira de Engenharia Biomedica";journal;"15173151";0,179;Q4;7;9;125;274;77;118;0,65;30,44;Brazil;"Sociedade Brasileira de Engenharia Biomedica";"Biomedical Engineering (Q4)"
398;29996;"Archivos Latinoamericanos de Nutricion";journal;"00040622";0,179;Q3;29;47;107;1299;41;101;0,30;27,64;Venezuela;"Sociedad Latinoamericana de Nutricion";"Medicine (miscellaneous) (Q3); Nutrition and Dietetics (Q4)"
399;18367;"Medicina";journal;"00257680";0,179;Q3;28;101;347;1960;103;218;0,51;19,41;Argentina;"Fundacion Revista Medicina";"Medicine (miscellaneous) (Q3)"
400;21100208082;"VacciMonitor";journal;"10250298, 1025028X";0,177;Q4;3;13;33;236;13;31;0,14;18,15;Cuba;"Instituto Finlay, Centro de Investigacion-Produccion de Vacunas y Sueros";"Drug Discovery (Q4); Immunology (Q4); Immunology and Allergy (Q4); Molecular Medicine (Q4)"
401;19900193610;"Boletin de Malariologia y Salud Ambiental";journal;"16904648";0,176;Q4;7;3;72;108;11;71;0,16;36,00;Venezuela;"Instituto de Altos Estudios ";"Infectious Diseases (Q4); Parasitology (Q4); Public Health, Environmental and Occupational Health (Q4)"
402;11500153501;"Pan-American Journal of Aquatic Sciences";journal;"18099009";0,176;Q4;15;19;113;810;32;113;0,25;42,63;Brazil;"Panamjas";"Aquatic Science (Q4); Ecology, Evolution, Behavior and Systematics (Q4)"
403;21100224444;"Agronomia Colombiana";journal;"01209965";0,175;Q4;7;32;147;1027;60;137;0,35;32,09;Colombia;"Universidad Nacional de Colombia";"Agronomy and Crop Science (Q4)"
404;28023;"Gaceta Medica de Mexico";journal;"00163813";0,175;Q3;18;115;397;3213;142;359;0,37;27,94;Mexico;"Academia Nacional de Medicina";"Medicine (miscellaneous) (Q3)"
405;13000154718;"Revista Signos";journal;"00350451, 07180934";0,174;Q1;10;21;70;948;23;68;0,26;45,14;Chile;"Pontificia Universidad Catolica de Valparaiso";"Literature and Literary Theory (Q1); Language and Linguistics (Q2); Linguistics and Language (Q2)"
406;20856;"West Indian Medical Journal";journal;"00433144, 23095830";0,174;Q3;27;133;341;2851;120;286;0,45;21,44;Jamaica;"University of the West Indies";"Medicine (miscellaneous) (Q3)"
407;5700168481;"Revista Brasileira de Politica Internacional";journal;"00347329";0,174;Q2;11;18;72;851;38;70;0,39;47,28;Brazil;"Instituto Brasileiro de Relacoes Internacionais";"History (Q2); Political Science and International Relations (Q3)"
408;19200156966;"Revista MVZ Cordoba";journal;"19090544, 01220268";0,173;Q3;7;26;148;599;47;139;0,20;23,04;Colombia;"Universidad de Cordoba";"Veterinary (miscellaneous) (Q3); Animal Science and Zoology (Q4); Aquatic Science (Q4)"
409;19332;"Salud Mental";journal;"01853325";0,173;Q4;21;16;77;572;41;67;0,47;35,75;Mexico;"Instituto Nacional de Psiquiatria Ramon de la Fuente";"Clinical Psychology (Q4); Psychiatry and Mental Health (Q4)"
410;26181;"Trimestre Economico";journal;"00413011";0,173;Q4;9;29;84;1140;18;83;0,17;39,31;Mexico;"Fondo de Cultura Economica";"Economics and Econometrics (Q4)"
411;16555;"Phyton";journal;"18515657, 00319457";0,173;Q4;12;43;157;1477;56;154;0,32;34,35;Argentina;"Fundacion Romulo Raggio";"Biochemistry (Q4); Physiology (Q4); Plant Science (Q4)"
412;19700180913;"Psicologia USP";journal;"01036564";0,173;Q4;7;51;154;1389;25;144;0,13;27,24;Brazil;"Universidade de Sao Paulo";"Psychology (miscellaneous) (Q4)"
413;21100312414;"Temas em Psicologia";journal;"21753652, 1413389X";0,173;Q4;3;89;253;3592;66;249;0,21;40,36;Brazil;"Sociedade Brasileira de Psicologia";"Psychology (miscellaneous) (Q4)"
414;12400154740;"Revista Facultad de Ingenieria";journal;"01206230";0,172;Q3;9;42;219;1088;68;208;0,31;25,90;Colombia;"Universidad de Antioquia";"Engineering (miscellaneous) (Q3)"
415;22595;"Revista de Salud Publica";journal;"01240064";0,171;Q4;19;66;278;1904;73;274;0,19;28,85;Colombia;"Universidad Nacional de Colombia";"Public Health, Environmental and Occupational Health (Q4)"
416;78240;"Revista Argentina de Cardiologia";journal;"00347000";0,171;Q3;9;72;407;888;33;162;0,12;12,33;Argentina;"Sociedad Argentina De Cardiologia";"Cardiology and Cardiovascular Medicine (Q3)"
417;21100200406;"Tropical and Subtropical Agroecosystems";journal;"18700462";0,171;Q3;10;49;124;2111;37;124;0,27;43,08;Mexico;"Universidad Autonoma de Yucatan";"Agricultural and Biological Sciences (miscellaneous) (Q3); Ecology (Q4); Ecology, Evolution, Behavior and Systematics (Q4)"
418;15786;"Revista Chilena de Pediatria";journal;"03704106, 07176228";0,171;Q3;13;122;275;2753;90;215;0,40;22,57;Chile;"Sociedad Chilena de Pediatria";"Pediatrics, Perinatology and Child Health (Q3)"
419;19700173306;"Revista Latinoamericana de Investigacion en Matematica Educativa";journal;"16652436";0,171;Q4;6;10;62;377;10;54;0,35;37,70;Mexico;"Latinoamericano de Matematica Educativa";"Education (Q4)"
420;15788;"Revista Cubana de Pediatria";journal;"00347531, 15613119";0,170;Q3;7;64;180;1514;28;159;0,19;23,66;Cuba;"Editorial Ciencias Medicas";"Pediatrics, Perinatology and Child Health (Q3)"
421;21100264507;"Revista Peruana de Biologia";journal;"15610837, 17279933";0,170;Q3;16;51;119;1738;25;116;0,25;34,08;Peru;"Asociacion de Biologos de la Universidad Nacional Mayor de San Marcos";"Agricultural and Biological Sciences (miscellaneous) (Q3)"
422;19700201528;"Revista Mexicana De Ciencias Pecuarias";journal;"20071124";0,170;Q3;6;50;102;1777;30;102;0,24;35,54;Mexico;"Instituto Nacional de Investigaciones Forestales, Agricolas y Pecuarias";"Veterinary (miscellaneous) (Q3); Animal Science and Zoology (Q4)"
423;21030;"Cirugia y Cirujanos";journal;"00097411";0,170;Q4;13;127;325;2438;114;275;0,45;19,20;Mexico;"Academic Mexicana de Cirugia";"Surgery (Q4)"
424;18300156736;"Acta Scientiarum - Technology";journal;"18078664, 18062563";0,168;Q3;12;75;216;1976;77;215;0,30;26,35;Brazil;"Universidade Estadual de Maringa";"Computer Science (miscellaneous) (Q3); Earth and Planetary Sciences (miscellaneous) (Q3); Engineering (miscellaneous) (Q3); Chemistry (miscellaneous) (Q4); Mathematics (miscellaneous) (Q4); Physics and Astronomy (miscellaneous) (Q4)"
425;4700152285;"Revista Chilena de Nutricion";journal;"07177518, 07161549";0,167;Q4;14;52;167;1779;57;165;0,23;34,21;Chile;"Sociedad Chilena de Nutricion, Bromatologia, Toxicologia";"Food Science (Q4); Nutrition and Dietetics (Q4)"
426;21100231621;"Journal of Coloproctology";journal;"22379363";0,167;Q3;8;62;139;1261;47;131;0,24;20,34;Brazil;"Sociedade Brasileira de Coloproctologia";"Gastroenterology (Q3)"
427;20500195050;"Scientia Agraria";journal;"19832443, 15191125";0,167;Q4;8;63;37;1998;9;37;0,24;31,71;Brazil;"Universidade Federal do Parana";"Agronomy and Crop Science (Q4); Plant Science (Q4); Soil Science (Q4)"
428;12600154771;"DYNA";journal;"00127353";0,167;Q3;11;125;532;3865;200;520;0,34;30,92;Colombia;"Universidad Nacional de Colombia";"Engineering (miscellaneous) (Q3)"
429;5600155076;"Revista de Estudios Sociales";journal;"0123885X";0,166;Q2;7;47;187;1902;45;149;0,26;40,47;Colombia;"Universidad de los Andes";"Cultural Studies (Q2); History (Q2); Arts and Humanities (miscellaneous) (Q3); Gender Studies (Q3); Social Sciences (miscellaneous) (Q3); Sociology and Political Science (Q3)"
430;21100220106;"Hidrobiologica";journal;"24487333, 01888897";0,166;Q3;11;26;131;1057;36;126;0,26;40,65;Mexico;"Department of Hydrobiology,Universidad Autonoma Metropolitana-Unidad Iztapalapa";"Water Science and Technology (Q3); Aquatic Science (Q4); Ecology (Q4); Ecology, Evolution, Behavior and Systematics (Q4); Oceanography (Q4)"
431;110559;"Proceedings of the IEEE International Symposium on Computer-Aided Control System Design";conference and proceedings;"-";0,165;-;21;0;25;0;6;24;0,25;0,00;Argentina;"";"Computer Science Applications; Control and Optimization; Control and Systems Engineering"
432;21100312021;"Antiguo Oriente";journal;"16679202";0,164;Q1;2;0;21;0;4;21;0,00;0,00;Argentina;"Pontifical Catholic University of Argentina";"Classics (Q1); Archeology (Q2); Archeology (arts and humanities) (Q2); History (Q2)"
433;21100403825;"Avaliacao Psicologica";journal;"16770471, 21753431";0,164;Q4;2;30;104;948;12;99;0,12;31,60;Brazil;"Instituto Brasileiro de Avaliacao Psicologica";"Psychology (miscellaneous) (Q4)"
434;4700152249;"Educacao e Pesquisa";journal;"15179702";0,163;Q4;11;73;228;2395;43;214;0,15;32,81;Brazil;"Universidade de Sao Paulo, Faculdade de Educacao";"Education (Q4)"
435;19700190322;"Brazilian Journal of Veterinary Pathology";journal;"19830246";0,162;Q4;8;21;67;522;26;64;0,17;24,86;Brazil;"Brazilian Association of Veterinary Pathology";"Veterinary (miscellaneous) (Q4)"
436;21100202750;"Historia (Chile)";journal;"00732435";0,162;Q2;3;21;48;684;16;48;0,31;32,57;Chile;"Pontificia Universidad Catolica de Chile";"Cultural Studies (Q2); History (Q2); History and Philosophy of Science (Q3)"
437;19287;"Revista Ecuatoriana de Neurologia";journal;"10198113";0,162;Q4;4;32;44;837;8;40;0,16;26,16;Ecuador;"Sociedad Ecuatoriana de Neurologia";"Neurology (Q4); Neurology (clinical) (Q4)"
438;19400157258;"Salud Uninorte";journal;"01205552";0,161;Q4;7;28;160;856;25;151;0,11;30,57;Colombia;"Universidad del Norte";"Medicine (miscellaneous) (Q4)"
439;19700186845;"Ingenieria y Universidad";journal;"20112769, 01232126";0,161;Q3;4;12;62;363;32;60;0,69;30,25;Colombia;"Pontificia Universidad Javeriana";"Engineering (miscellaneous) (Q3)"
440;21100810419;"Revista Brasileira de Recursos Hidricos";journal;"23180331";0,161;Q4;2;54;76;1843;26;76;0,34;34,13;Brazil;"Brazilian Journal of Water Resources";"Aquatic Science (Q4); Earth-Surface Processes (Q4); Oceanography (Q4); Water Science and Technology (Q4)"
441;21100212700;"RAE Revista de Administracao de Empresas";journal;"00347590";0,160;Q3;8;51;152;2150;72;139;0,41;42,16;Brazil;"Fundacao Getulio Vargas, Escola de Administracao de Empresas de Sao Paulo";"Development (Q3); Industrial Relations (Q3); Marketing (Q3); Education (Q4); Public Administration (Q4); Strategy and Management (Q4)"
442;21100791269;"Journal of Animal Behaviour and Biometeorology";journal;"23181265";0,160;Q4;4;20;63;668;24;62;0,23;33,40;Brazil;"Universidade Federal Rural do Semi-Arido";"Animal Science and Zoology (Q4); Atmospheric Science (Q4); Ecology (Q4)"
443;6100153026;"Revista Chilena de Literatura";journal;"00487651, 07182295";0,160;Q1;6;29;134;857;10;130;0,09;29,55;Chile;"Universidad de Chile";"Literature and Literary Theory (Q1)"
444;21100264819;"Vniversitas";journal;"00419060, 20111711";0,160;Q3;2;24;73;1499;4;71;0,02;62,46;Colombia;"Pontificia Universidad Javeriana";"Law (Q3)"
445;21100792747;"Ornamental Horticulture";journal;"2447536X";0,160;Q4;2;42;48;943;4;47;0,09;22,45;Brazil;"Brazilian Society of Floriculture and Ornamental Plants";"Horticulture (Q4); Plant Science (Q4)"
446;12100155503;"Revista Latinoamericana de Hipertension";journal;"18564550";0,158;Q3;4;27;34;1002;10;34;0,41;37,11;Venezuela;"Latin American Society of Hypertension (LASH)";"Internal Medicine (Q3); Cardiology and Cardiovascular Medicine (Q4)"
447;5200152705;"Avances en Psicología Latinoamericana";journal;"17944724";0,158;Q4;7;29;112;1158;36;106;0,21;39,93;Colombia;"Universidad del Rosario (Colombia)";"Clinical Psychology (Q4)"
448;4700152719;"Ciencia y Enfermeria";journal;"07172079, 07179553";0,158;Q4;11;10;107;251;18;98;0,08;25,10;Chile;"Universidad de Concepcion, Facultad de Medicina, Departmento de Enfermeria";"Nursing (miscellaneous) (Q4)"
449;21100456601;"Journal of Pharmacy and Pharmacognosy Research";journal;"07194250";0,158;Q3;4;37;66;1126;32;65;0,29;30,43;Chile;"Asociacion Academica de Ciencias Farmaceuticas de Antofagasta (ASOCIFA)";"Pharmaceutical Science (Q3); Drug Discovery (Q4); Pharmacology (Q4)"
450;25356;"Revista de gastroenterologia del Peru : organo oficial de la Sociedad de Gastroenterologia del Peru";journal;"10225129, 1609722X";0,157;Q4;14;17;159;0;42;136;0,24;0,00;Peru;"Sociedad de Gastroenterologia del Peru";"Medicine (miscellaneous) (Q4)"
451;5700163481;"Nova Economia";journal;"01036351";0,156;Q3;5;33;97;1311;13;97;0,08;39,73;Brazil;"Universidade Federal de Minas Gerais";"Economics, Econometrics and Finance (miscellaneous) (Q3)"
452;5600152869;"Novos Estudos CEBRAP";journal;"01013300, 19805403";0,156;Q3;11;33;94;1276;20;91;0,27;38,67;Brazil;"CEBRAP - Centro Brasileiro de Analise e Planejamento";"Social Sciences (miscellaneous) (Q3)"
453;4700152225;"Gestao e Producao";journal;"0104530X";0,156;Q3;13;64;197;2676;39;184;0,18;41,81;Brazil;"Universidade Federal de Sao Carlos";"Business and International Management (Q3); Industrial and Manufacturing Engineering (Q3)"
454;20000195063;"Revista em Agronegocio e Meio Ambiente";journal;"19819951, 21769168";0,156;Q4;5;67;144;2188;27;136;0,22;32,66;Brazil;"University Centre of Maringa - CESUMAR";"Agricultural and Biological Sciences (miscellaneous) (Q4); Environmental Science (miscellaneous) (Q4)"
455;15234;"Investigacion Clinica";journal;"05355133";0,155;Q4;19;32;133;1303;40;98;0,39;40,72;Venezuela;"Universidad del Zulia";"Medicine (miscellaneous) (Q4)"
456;12100154831;"Universum";journal;"07182376, 0716498X";0,155;Q3;7;28;90;850;15;85;0,09;30,36;Chile;"Editorial Universidad de Talca";"Arts and Humanities (miscellaneous) (Q3); Social Sciences (miscellaneous) (Q3)"
457;11600154629;"Acta ortopédica mexicana";journal;"23064102";0,154;Q4;6;0;93;0;17;87;0,21;0,00;Mexico;"Sociedad Mexicana de Ortopedia";"Medicine (miscellaneous) (Q4)"
458;19500157818;"Cuadernos de Desarrollo Rural";journal;"01221450";0,154;Q3;6;0;36;0;13;36;0,26;0,00;Colombia;"Pontificia Universidad Javeriana";"Geography, Planning and Development (Q3); Agronomy and Crop Science (Q4); Economics and Econometrics (Q4)"
459;13000154708;"Revista Colombiana de Anestesiologia";journal;"01203347";0,154;Q3;7;89;193;2286;69;162;0,47;25,69;Colombia;"Elsevier Doyma";"Anesthesiology and Pain Medicine (Q3); Critical Care and Intensive Care Medicine (Q3)"
460;12732;"Ginecologia y Obstetricia de Mexico";journal;"03009041";0,153;Q3;14;117;356;2475;80;299;0,24;21,15;Mexico;"Asociacion Mexicana de Ginecologia y Obstetricia";"Obstetrics and Gynecology (Q3); Medicine (miscellaneous) (Q4)"
461;20500195022;"Tecnologia y Ciencias del Agua";journal;"01878336";0,153;Q4;9;69;199;2103;45;199;0,25;30,48;Mexico;"Instituto Mexicano de Tecnologia del Agua";"Civil and Structural Engineering (Q4); Water Science and Technology (Q4)"
462;5600155211;"Historia Critica";journal;"01211617";0,153;Q2;6;35;116;1400;16;102;0,15;40,00;Colombia;"Universidad de los Andes";"Cultural Studies (Q2); History (Q2); Social Sciences (miscellaneous) (Q3); Geography, Planning and Development (Q4)"
463;25279;"Revista Internacional de Contaminacion Ambiental";journal;"01884999";0,152;Q4;14;84;135;3196;38;132;0,24;38,05;Mexico;"Universidad Nacional Autónoma de México, Universidad Autónoma de México, Universidad Autónoma de Tlaxcala, Universidad de Veracruzana";"Pollution (Q4); Waste Management and Disposal (Q4)"
464;19381;"Acta Farmaceutica Bonaerense";journal;"03262383";0,152;Q3;22;382;916;9132;387;908;0,43;23,91;Argentina;"Colegio de Farmaceuticos de la Provincia de Buenos Aires";"Pharmaceutical Science (Q3); Drug Discovery (Q4)"
465;19400157242;"Revista Latinoamericana de Metalurgia y Materiales";journal;"02556952";0,152;Q3;7;24;126;727;19;117;0,17;30,29;Venezuela;"Universidad Simon Bolivar";"Industrial and Manufacturing Engineering (Q3); Materials Science (miscellaneous) (Q4)"
466;19600157208;"Pesquisas em Geociencias";journal;"15182398";0,152;Q4;6;30;53;1397;14;53;0,26;46,57;Brazil;"Universidade Federal do Rio Grande do Sul";"Earth and Planetary Sciences (miscellaneous) (Q4)"
467;21100800033;"Varia Historia";journal;"01048775, 19824343";0,152;Q2;1;32;35;814;2;31;0,06;25,44;Brazil;"Universidade Federal de Minas Gerais";"History (Q2)"
468;21100200415;"Revista Colombiana de Psicologia";journal;"01215469";0,151;Q3;5;21;66;942;18;62;0,28;44,86;Colombia;"Universidad Nacional de Colombia";"Social Sciences (miscellaneous) (Q3); Psychology (miscellaneous) (Q4)"
469;8000153116;"Revista Mexicana de Astronomia y Astrofisica: Serie de Conferencias";conference and proceedings;"14052059";0,151;-;23;0;174;0;18;168;0,00;0,00;Mexico;"";"Astronomy and Astrophysics; Space and Planetary Science"
470;34848;"Boletin Medico del Hospital Infantil de Mexico";journal;"05396115, 16651146";0,151;Q3;8;58;189;1735;50;166;0,33;29,91;Mexico;"Hospital Infantil de Mexico Federico Gomez";"Pediatrics, Perinatology and Child Health (Q3)"
471;21100239819;"Historia da Educacao";journal;"22363459, 14143518";0,151;Q4;2;67;150;2133;11;143;0,07;31,84;Brazil;"Universidade Federal de Santa Maria";"Education (Q4)"
472;21100469663;"Revista de Psicologia (Peru)";journal;"22233733, 02549247";0,150;Q4;1;25;19;1335;4;17;0,24;53,40;Peru;"Pontificia Universidad Catolica del Peru";"Psychology (miscellaneous) (Q4)"
473;4700153602;"Sociologias";journal;"15174522";0,150;Q3;13;28;118;1052;27;108;0,23;37,57;Brazil;"Universidade Federal do Rio Grande do Sul";"Social Sciences (miscellaneous) (Q3)"
474;21100202112;"Acta Veterinaria Brasilica";journal;"19815484";0,149;Q4;5;22;312;558;43;310;0,17;25,36;Brazil;"Universidade Federal Rural do Semi-Arid";"Veterinary (miscellaneous) (Q4)"
475;21100403412;"IMPC 2014 - 27th International Mineral Processing Congress";conference and proceedings;"-";0,149;-;4;0;400;0;42;399;0,00;0,00;Chile;"";"Chemical Health and Safety; Safety Research; Safety, Risk, Reliability and Quality"
476;8600153122;"Archives of Veterinary Science";journal;"23176822, 1517784X";0,149;Q4;7;48;146;1336;26;146;0,11;27,83;Brazil;"Universidade Federal do Parana";"Veterinary (miscellaneous) (Q4)"
