Rank;Sourceid;Title;Type;Issn;SJR;SJR Best Quartile;H index;Total Docs. (2017);Total Docs. (3years);Total Refs.;Total Cites (3years);Citable Docs. (3years);Cites / Doc. (2years);Ref. / Doc.;Country;Publisher;Categories
242;5000156907;"Polimeros";journal;"01041428";0,244;Q3;18;68;281;2197;201;263;0,81;32,31;Brazil;"ABPol";"Chemical Engineering (miscellaneous) (Q3); Organic Chemistry (Q4)"
243;6600153105;"Revista Brasileira de Educacao";journal;"14132478, 1809449X";0,244;Q3;9;58;148;1962;38;135;0,30;33,83;Brazil;"Associacao Nacional de Pos-graduacao e Pesquisa em Educacao";"Education (Q3)"
244;11600154153;"Ingeniare";journal;"07183305, 07183291";0,239;Q2;8;64;193;1511;65;171;0,40;23,61;Chile;"Universidad Tarapacá. Sede Arica. Dpto de Antropología";"Engineering (miscellaneous) (Q2)"
245;19700175820;"Oecologia Australis";journal;"21776199";0,239;Q3;14;47;73;2405;33;69;0,46;51,17;Brazil;"Universidade Federal do Rio de Janeiro";"Ecology (Q3)"
246;7000153282;"Earth Sciences Research Journal";journal;"17946190";0,239;Q3;8;34;82;1045;40;76;0,55;30,74;Colombia;"Universidad Nacional de Colombia";"Earth and Planetary Sciences (miscellaneous) (Q3)"
247;12100154401;"Soldagem e Inspecao";journal;"01049224";0,238;Q3;8;43;134;808;36;127;0,26;18,79;Brazil;"Associacao Brasileira da Soldagem";"Mechanical Engineering (Q3); Mechanics of Materials (Q3); Metals and Alloys (Q3)"
248;19900193545;"Boletimdo Museu Paraense Emilio Goeldi:Ciencias Humanas";journal;"19818122";0,238;Q2;8;51;121;2631;32;111;0,27;51,59;Brazil;"Museu Paraense Emilio Goeldi";"Anthropology (Q2); Archeology (Q2); Archeology (arts and humanities) (Q2); Language and Linguistics (Q2); Linguistics and Language (Q2)"
249;5000160208;"Revista Cubana de Educacion Medica Superior";journal;"15612902, 08642141";0,237;Q3;9;75;232;1419;71;211;0,28;18,92;Cuba;"Editorial Ciencias Medicas";"Education (Q3); Medicine (miscellaneous) (Q3)"
250;5000156908;"Revista Brasileira de Ciencia Avicola";journal;"1516635X";0,237;Q3;17;114;282;3704;152;279;0,49;32,49;Brazil;"Fundacao APINCO de Ciencia e Technologia Avicolas";"Animal Science and Zoology (Q3)"
251;5000154002;"Gayana";journal;"07176538, 0717652X";0,236;Q3;14;10;67;412;33;62;0,45;41,20;Chile;"Facultad de Ciencias Naturales y Oceanograficas, Universidad de Concepcion";"Animal Science and Zoology (Q3); Aquatic Science (Q4)"
252;6600153102;"Journal of Applied Economics";journal;"15140326, 16676726";0,235;Q2;16;18;49;630;32;49;0,53;35,00;Argentina;"Elsevier Ltd.";"Economics, Econometrics and Finance (miscellaneous) (Q2)"
253;5600155441;"Ambiente & Sociedade";journal;"1414753X";0,235;Q3;12;57;170;2480;75;158;0,36;43,51;Brazil;"Nucleo de Estudos e Pesquisas Ambientais";"Environmental Science (miscellaneous) (Q3); Social Sciences (miscellaneous) (Q3)"
254;15601;"Gayana - Botanica";journal;"07176643, 00165301";0,234;Q3;13;33;116;1284;53;113;0,41;38,91;Chile;"Facultad de Ciencias Naturales y Oceanograficas, Universidad de Concepcion";"Ecology (Q3); Horticulture (Q3); Plant Science (Q3)"
255;17600155205;"Revista de la Construccion";journal;"07177925";0,234;Q3;6;47;85;1208;49;85;0,47;25,70;Chile;"Pontificia Universidad Catolica de Chile";"Building and Construction (Q3); Civil and Structural Engineering (Q3)"
256;5600152968;"Caderno CRH";journal;"01034979";0,233;Q2;6;40;135;1422;19;115;0,06;35,55;Brazil;"Federal University of Bahia Human Resources Center";"Cultural Studies (Q2); Sociology and Political Science (Q3)"
257;21100399153;"Boletin del Museo Chileno de Arte Precolombino";journal;"07186894, 07161530";0,233;Q1;2;21;42;916;12;38;0,14;43,62;Chile;"Museo Chileno de Arte Precolombino";"Visual Arts and Performing Arts (Q1); Anthropology (Q2); Archeology (Q2); Archeology (arts and humanities) (Q2)"
258;21100416194;"Estudos de Psicologia (Campinas)";journal;"19820275";0,233;Q3;3;52;142;1771;43;134;0,32;34,06;Brazil;"Pontificia Universidade Catolica de Campinas";"Psychology (miscellaneous) (Q3)"
259;4700152715;"Horizontes Antropologicos";journal;"01047183";0,233;Q2;10;50;95;1774;26;93;0,15;35,48;Brazil;"Universidade Federal do Rio Grande do Sul";"Anthropology (Q2)"
260;21100815415;"Colombia Forestal";journal;"01200739, 2256201X";0,233;Q3;2;15;15;596;8;15;0,53;39,73;Colombia;"Universidad Distrital Francisco Jose de Caldas";"Forestry (Q3); Nature and Landscape Conservation (Q3); Soil Science (Q3)"
261;21100400803;"Revista Iberoamericana de Educacion Superior";journal;"20072872";0,232;Q3;3;33;60;1128;19;60;0,32;34,18;Mexico;"Elsevier BV";"Education (Q3)"
262;4400151727;"Estudos Avancados";journal;"01034014";0,232;Q2;17;84;202;1621;40;185;0,22;19,30;Brazil;"Universidade de Sao Paulo, Institudo de Estudos Avancados";"Cultural Studies (Q2); Sociology and Political Science (Q3)"
263;20000195045;"Revista Colombiana de Antropologia";journal;"04866525";0,232;Q2;4;17;70;763;14;66;0,26;44,88;Colombia;"Instituto Colombiano de Antropologia e Historia";"Anthropology (Q2)"
264;19800188009;"Iheringia - Serie Botanica";journal;"00734705";0,231;Q3;13;32;108;1251;32;102;0,23;39,09;Brazil;"Fundacao Zoobotanica do Rio Grande";"Plant Science (Q3)"
265;4900152701;"Brazilian Journal of Cardiovascular Surgery";journal;"01027638";0,231;Q3;21;93;314;1785;136;253;0,73;19,19;Brazil;"Sociedade Brasileira de Cirurgia Cardiovascular";"Cardiology and Cardiovascular Medicine (Q3); Medicine (miscellaneous) (Q3); Surgery (Q3)"
266;19600161819;"Revista de la Facultad de Ciencias Agrarias";journal;"03704661";0,230;Q3;7;43;109;1404;98;109;1,13;32,65;Argentina;"Universidad Nacional de Cuyo";"Agronomy and Crop Science (Q3); Plant Science (Q3)"
267;13565;"Revista de Biologia Marina y Oceanografia";journal;"07173326";0,230;Q4;20;59;189;2624;81;183;0,29;44,47;Chile;"Universidad de Valparaiso";"Aquatic Science (Q4); Oceanography (Q4)"
268;29385;"Revista brasileira de enfermagem";journal;"00347167";0,230;Q3;16;59;400;0;186;385;0,41;0,00;Brazil;"Associacao Brasileira de Enfermagem";"Medicine (miscellaneous) (Q3)"
269;19700182354;"Movimento";journal;"19828918, 0104754X";0,230;Q3;8;108;252;3168;85;243;0,21;29,33;Brazil;"Universidade Federal do Rio Grande do Sul";"Education (Q3)"
270;33825;"Geociencias";journal;"01019082";0,230;Q3;14;56;141;1948;43;141;0,33;34,79;Brazil;"Fundacao Editora UNESP";"Earth and Planetary Sciences (miscellaneous) (Q3)"
271;5700160666;"Revista Brasileira de Crescimento e Desenvolvimento Humano";journal;"01041282";0,229;Q4;7;45;134;1316;65;127;0,57;29,24;Brazil;"Centro de Estudos do Crescimento e do Desenvolvimento do Ser Humano";"Life-span and Life-course Studies (Q4)"
272;21100312401;"Revista Cubana de Informacion en Ciencias de la Salud";journal;"23072113";0,229;Q3;8;29;112;698;32;93;0,32;24,07;Cuba;"Centro Nacional De Informacion De Ciencias Medicas";"Health Policy (Q3); Library and Information Sciences (Q3); Health Information Management (Q4)"
273;21100469599;"Therya";journal;"20073364";0,229;Q3;3;40;55;1573;32;49;0,65;39,33;Mexico;"Asociacion Mexicana de Mastozoologia";"Animal Science and Zoology (Q3)"
274;4700152863;"Psicologia em Estudo";journal;"14137372";0,229;Q3;13;57;199;1536;31;183;0,11;26,95;Brazil;"Universidade Estadual de Maringa";"Psychology (miscellaneous) (Q3)"
275;21100258755;"Revista Chapingo, Serie Horticultura";journal;"1027152X";0,229;Q3;7;16;55;515;25;55;0,50;32,19;Mexico;"Universidad Autonoma Chapingo";"Horticulture (Q3); Plant Science (Q3)"
276;21100447821;"Poblacion y Sociedad";journal;"18528562, 03283445";0,227;Q3;1;11;24;543;9;22;0,41;49,36;Argentina;"Grupo Editor Yocavil";"Demography (Q3)"
277;21100223167;"Computacion y Sistemas";journal;"14055546";0,226;Q3;7;71;190;1968;112;177;0,37;27,72;Mexico;"Centro de Investigacion en Computacion (CIC) del Instituto Politecnico Nacional (IPN)";"Computer Science (miscellaneous) (Q3)"
278;19400156818;"Revista Peruana de Medicina Experimental y Salud Publica";journal;"17264634, 17264642";0,226;Q3;14;119;429;2567;194;317;0,47;21,57;Peru;"Instituto Nacional de Salud";"Medicine (miscellaneous) (Q3); Public Health, Environmental and Occupational Health (Q3)"
279;29388;"Revista gaucha de enfermagem / EENFUFRGS";journal;"19831447, 01026933";0,225;Q3;11;17;227;0;108;218;0,45;0,00;Brazil;"Universidade Federal do Rio Grande do Sul";"Medicine (miscellaneous) (Q3)"
280;19700182219;"Brazilian Journal of Veterinary Research and Animal Science";journal;"14139596, 16784456";0,225;Q3;12;54;153;1577;54;147;0,40;29,20;Brazil;"Universidade de Sao Paulo. Faculdade de Medicina Veterinari";"Veterinary (miscellaneous) (Q3)"
281;21100211304;"Psicologia Escolar e Educacional";journal;"21753539, 14138557";0,225;Q4;5;72;185;1959;41;175;0,17;27,21;Brazil;"Associacao Brasileira de Psicologia Escolar e Educacional (ABRAPEE)";"Developmental and Educational Psychology (Q4); Social Psychology (Q4)"
282;73135;"Ciencia del Suelo";journal;"03263169";0,224;Q3;15;33;80;1486;32;80;0,24;45,03;Argentina;"Asociacion Argentina de la Ciencia del Suelo";"Soil Science (Q3)"
283;14500154705;"Revista Argentina de Clinica Psicologica";journal;"03276716";0,224;Q3;8;36;87;1492;34;80;0,55;41,44;Argentina;"Fundacion Aigle";"Clinical Psychology (Q3); Psychiatry and Mental Health (Q3)"
284;16240;"Jornal Brasileiro de Psiquiatria";journal;"00472085";0,224;Q3;19;32;142;929;58;136;0,38;29,03;Brazil;"ECN - Editora Cientifica Nacional Ltda.";"Psychiatry and Mental Health (Q3)"
285;12000154552;"Idesia";journal;"00734675, 07183429";0,223;Q3;8;64;192;1342;52;179;0,21;20,97;Chile;"Universidad Tarapacá. Sede Arica. Dpto de Antropología";"Agricultural and Biological Sciences (miscellaneous) (Q3); Agronomy and Crop Science (Q3)"
286;21100217020;"Revista Iberoamericana de Diagnostico y Evaluacion Psicologica";journal;"11353848";0,223;Q3;8;44;72;1948;38;69;0,45;44,27;Argentina;"Asociacion Iberoamericana de Diagnostico y Evaluacion";"Psychology (miscellaneous) (Q3)"
287;19200156945;"Boletin Latinoamericano y del Caribe de Plantas Medicinales y Aromaticas";journal;"07177917";0,222;Q3;15;41;139;2250;87;139;0,61;54,88;Chile;"Universidad de Santiago de Chile";"Complementary and Alternative Medicine (Q3); Drug Discovery (Q3); Pharmacology (Q3); Plant Science (Q3)"
288;10800153307;"Revista do Colegio Brasileiro de Cirurgioes";journal;"01006991";0,221;Q3;14;94;273;2502;144;249;0,47;26,62;Brazil;"Colegio Brasileiro de Cirurgioes";"Surgery (Q3)"
289;17500155111;"Salud Colectiva";journal;"16692381";0,220;Q3;9;50;120;2224;41;106;0,39;44,48;Argentina;"Universidad Nacional de Lanus";"Health Policy (Q3); Public Health, Environmental and Occupational Health (Q4)"
290;19700176046;"Boletim do Instituto de Pesca";journal;"00469939, 16782305";0,220;Q3;10;61;235;2473;94;234;0,36;40,54;Brazil;"Instituto de Pesca";"Animal Science and Zoology (Q3); Aquatic Science (Q4)"
291;19900191879;"Informacao e Sociedade";journal;"18094783, 01040146";0,220;Q3;5;63;128;1844;27;119;0,19;29,27;Brazil;"Universidade Federal de Campina Grande";"Communication (Q3); Sociology and Political Science (Q3)"
292;21100379744;"Contaduria y Administracion";journal;"01861042";0,219;Q3;4;95;157;3460;64;141;0,45;36,42;Mexico;"Universidad Nacional Autonoma de Mexico";"Business, Management and Accounting (miscellaneous) (Q3)"
293;19400158588;"Revista Chapingo, Serie Ciencias Forestales y del Ambiente";journal;"20073828, 20074018";0,218;Q3;5;26;85;884;42;84;0,45;34,00;Mexico;"Universidad Autonoma Chapingo";"Ecology (Q3); Forestry (Q3)"
294;5700161162;"Papeles de Poblacion";journal;"14057425";0,218;Q3;7;36;102;1306;31;96;0,30;36,28;Mexico;"Universidad Autonoma del Estado de Mexico, Centro de Investigacion y Estudios Avanzados de la Poblacion";"Demography (Q3)"
295;4700152869;"Engenharia Sanitaria e Ambiental";journal;"14134152";0,218;Q3;12;126;225;3763;108;218;0,35;29,87;Brazil;"Associacao Brasileira de Engenharia Sanitaria e Ambiental";"Waste Management and Disposal (Q3)"
296;5800169849;"Colombia Internacional";journal;"01215612";0,218;Q1;3;31;91;1353;13;81;0,19;43,65;Colombia;"Universidad de los Andes";"History (Q1); Political Science and International Relations (Q3); Sociology and Political Science (Q3)"
297;12100155635;"Anuario do Instituto de Geociencias";journal;"01019759";0,216;Q3;8;81;105;2664;29;105;0,23;32,89;Brazil;"Universidade Federal do Rio de Janeiro";"Development (Q3); Economic Geology (Q3); Environmental Science (miscellaneous) (Q3); Geography, Planning and Development (Q3); Geology (Q4)"
298;21100212320;"Ciencia Animal Brasileira";journal;"18096891, 15182797";0,216;Q3;6;21;204;501;69;203;0,30;23,86;Brazil;"Universidade Federal De Goias (UFG)";"Veterinary (miscellaneous) (Q3); Animal Science and Zoology (Q4)"
299;24244;"Revista Mexicana de Ciencias Politicas y Sociales";journal;"01851918, 2448492X";0,215;Q3;3;48;144;2095;33;136;0,24;43,65;Mexico;"Facultad de Ciencias Politicas y Sociales, UNAM";"Sociology and Political Science (Q3); Urban Studies (Q3)"
300;19700174729;"Journal of the Mexican Chemical Society";journal;"16659686, 1870249X";0,214;Q3;15;22;127;1035;113;124;0,54;47,05;Mexico;"Sociedad Quimica de Mexico";"Chemistry (miscellaneous) (Q3)"
301;19700182901;"Brazilian Journal of Pharmaceutical Sciences";journal;"19848250, 21759790";0,214;Q2;28;96;281;3410;198;275;0,54;35,52;Brazil;"Universidade de Sao Paulo";"Pharmacology, Toxicology and Pharmaceutics (miscellaneous) (Q2)"
302;21100211373;"Formacion Universitaria";journal;"07185006";0,213;Q3;8;56;159;1614;114;152;0,76;28,82;Chile;"Centro de Informacion Tecnologica";"Education (Q3)"
303;21100200413;"Revista de Investigaciones Veterinarias del Peru";journal;"16099117, 16823419";0,212;Q3;4;85;243;2379;42;243;0,16;27,99;Peru;"Facultad de Medicina Veterinaria, Universidad Nacional Mayor de San Marcos";"Veterinary (miscellaneous) (Q3)"
304;20000195095;"Meta: Avaliacao";journal;"21752753";0,212;Q3;3;23;52;763;15;52;0,35;33,17;Brazil;"Fundacao Cesgranrio";"Education (Q3)"
305;20000195050;"Paideia";journal;"19824327, 0103863X";0,212;Q3;6;27;127;890;66;120;0,50;32,96;Brazil;"Universidade of Sao Paulo, Faculty of Philosophy, Languages and Literature, and Human Sciences";"Education (Q3); Psychology (miscellaneous) (Q3)"
306;19700175587;"Interdisciplinaria";journal;"16687027, 03258203";0,212;Q3;7;12;57;627;17;57;0,18;52,25;Argentina;"Centro Interamericano de Investigaciones Psicologicas y Ciencias Afines";"Psychology (miscellaneous) (Q3)"
307;19200156903;"Acta Botanica Mexicana";journal;"01877151";0,212;Q3;9;29;81;1200;37;79;0,38;41,38;Mexico;"Instituto de Ecologia";"Plant Science (Q3); Ecology, Evolution, Behavior and Systematics (Q4)"
308;89299;"Revista brasileira de estudos de populacao";journal;"01023098";0,211;Q3;10;36;118;1169;26;99;0,11;32,47;Brazil;"Associacao Brasileira De Estudos Populacionais";"Demography (Q3)"
309;21100823466;"Revista Habanera de Ciencias Medicas";journal;"1729519X";0,211;Q3;5;94;273;2193;48;251;0,20;23,33;Cuba;"Universidad de Ciencias Medicas de La Habana";"Health Policy (Q3); Public Health, Environmental and Occupational Health (Q4)"
310;12700154743;"Psykhe";journal;"07170297";0,211;Q3;11;16;62;841;27;60;0,35;52,56;Chile;"Pontificia Universidad Catolica de Chile";"Psychology (miscellaneous) (Q3)"
311;69053;"Ciencia e Investigacion Agraria";journal;"03045609";0,211;Q3;14;31;127;945;64;127;0,38;30,48;Chile;"Universidad CatOlica de Chile, Escuela de Agronomia";"Agricultural and Biological Sciences (miscellaneous) (Q3)"
312;19700201433;"Boletim da Sociedade Paranaense de Matematica";journal;"00378712, 21751188";0,210;Q4;11;60;130;1239;37;130;0,31;20,65;Brazil;"Sociedade Brasileira de Matematica";"Mathematics (miscellaneous) (Q4)"
313;145456;"Entomotropica";journal;"13175262";0,209;Q4;8;0;78;0;32;78;0,35;0,00;Venezuela;"Sociedad Venezolana de Entomologia";"Insect Science (Q4)"
314;5600152899;"Revista de Ciencias Sociales";journal;"13159518";0,209;Q3;5;16;140;489;26;131;0,24;30,56;Venezuela;"Universidad del Zulia";"Social Sciences (miscellaneous) (Q3)"
315;19700188119;"Educacion Quimica";journal;"18708404, 0187893X";0,209;Q3;6;47;161;1025;43;146;0,31;21,81;Mexico;"National Autonomous University of Mexico, Faculty of Chemistry";"Chemistry (miscellaneous) (Q3); Education (Q3)"
316;145513;"Acta Scientiarum - Biological Sciences";journal;"16799283";0,208;Q3;20;60;179;2174;89;179;0,40;36,23;Brazil;"Universidade Estadual de Maringa";"Agricultural and Biological Sciences (miscellaneous) (Q3); Biochemistry, Genetics and Molecular Biology (miscellaneous) (Q3)"
317;6400153156;"Economia Aplicada";journal;"19805330, 14138050";0,208;Q3;7;14;83;496;11;83;0,09;35,43;Brazil;"Faculdade de Economia, Administracao e Contabilidade de Ribeirao Preto da Universidade de Sao Paulo";"Economics, Econometrics and Finance (miscellaneous) (Q3)"
318;21100447115;"Austral: Brazilian Journal of Strategy and International Relations";journal;"22386912";0,208;Q3;4;37;56;1426;8;53;0,18;38,54;Brazil;"Universidade Federal do Rio Grande do Sul";"Political Science and International Relations (Q3)"
319;23132;"Estudos Feministas";journal;"18069584, 0104026X";0,208;Q3;11;84;195;2630;29;181;0,15;31,31;Brazil;"Universidade Federal de Santa Catarina";"Gender Studies (Q3)"
320;21100229216;"Arquivos brasileiros de cirurgia digestiva : ABCD = Brazilian archives of digestive surgery";journal;"01026720";0,207;Q3;8;0;293;0;166;279;0,48;0,00;Brazil;"Colegio Brasileiro de Cirurgia Digestiva";"Medicine (miscellaneous) (Q3); Surgery (Q3)"
321;4500151504;"International Journal of Morphology";journal;"07179367, 07179502";0,207;Q3;20;242;719;6158;277;719;0,34;25,45;Chile;"Sociedad Chilena de Anatomia";"Anatomy (Q3)"
322;12100154830;"Bioagro";journal;"13163361";0,207;Q3;5;25;75;737;17;72;0,31;29,48;Venezuela;"Universidad Centro-Occidental Lisandro Alvarado";"Agricultural and Biological Sciences (miscellaneous) (Q3)"
323;21100432467;"Brazilian Journal of Food Technology";journal;"19816723";0,206;Q3;2;45;74;1588;32;73;0,44;35,29;Brazil;"Instituto de Tecnologia de Alimentos (ITAL)";"Food Science (Q3)"
324;21100401234;"Anuario Mexicano de Derecho Internacional";journal;"18704654";0,206;Q3;2;25;71;997;10;71;0,14;39,88;Mexico;"Universidad Nacional Autonoma de Mexico";"Law (Q3)"
325;19700172802;"Dementia e Neuropsychologia";journal;"19805764";0,205;Q3;13;65;186;2261;83;169;0,48;34,78;Brazil;"Associacao Neurologia Cognitiva e do Comportamento";"Neurology (clinical) (Q3); Cognitive Neuroscience (Q4); Geriatrics and Gerontology (Q4); Neurology (Q4); Sensory Systems (Q4)"
326;19700188347;"Journal of Aerospace Technology and Management";journal;"21759146, 19849648";0,204;Q3;11;48;145;1279;73;136;0,53;26,65;Brazil;"Instituto de Aeronautica e Espaco-IAE";"Aerospace Engineering (Q3)"
327;21100220436;"Revista Ingenieria de Construccion";journal;"07185073, 07162952";0,204;Q3;6;15;57;401;23;57;0,35;26,73;Chile;"Pontificia Universidad Catolica de Chile, Departamento de Ingenieria y Gestion de la Construccion";"Building and Construction (Q3); Civil and Structural Engineering (Q4)"
328;20708;"Estudos Economicos";journal;"19805357, 01014161";0,204;Q3;8;27;99;914;21;95;0,13;33,85;Brazil;"Instituto de Pesquisas Economicas";"Economics, Econometrics and Finance (miscellaneous) (Q3)"
329;4700152865;"Psicologia e Sociedade";journal;"01027182";0,204;Q4;13;12;232;363;55;223;0,16;30,25;Brazil;"Associacao Brasileira de Psicologia Social";"Social Psychology (Q4)"
330;29758;"Revista Mexicana de Fisica";journal;"0035001X";0,203;Q3;22;79;220;2198;95;220;0,48;27,82;Mexico;"Siciedad Mexicana de Fisica";"Education (Q3); Physics and Astronomy (miscellaneous) (Q4)"
331;17600155203;"Acta Biologica Colombiana";journal;"0120548X";0,203;Q3;9;37;184;1545;95;181;0,55;41,76;Colombia;"Universidad Nacional de Colombia";"Agricultural and Biological Sciences (miscellaneous) (Q3)"
332;11700154713;"Perspectivas em Ciencia da Informacao";journal;"14139936";0,203;Q2;7;60;172;1755;41;167;0,16;29,25;Brazil;"A Escola";"Museology (Q2); Communication (Q3); Library and Information Sciences (Q3); Information Systems (Q4)"
333;19700173159;"Reforma y Democracia";journal;"13152378";0,203;Q3;4;24;73;1167;12;73;0,18;48,63;Venezuela;"Centro Latinoamericano de Administracion para el Desarrollo (CLAD)";"Sociology and Political Science (Q3); Public Administration (Q4)"
334;3500148007;"Revista chilena de infectologia : organo oficial de la SociedadChilena de Infectologia.";journal;"07161018";0,202;Q4;16;115;414;2545;150;342;0,36;22,13;Chile;"Publicaciones Tecnicas Mediterraneo";"Infectious Diseases (Q4); Public Health, Environmental and Occupational Health (Q4)"
335;5000158301;"Revista Cubana de Medicina Militar";journal;"01386557, 15613046";0,202;Q3;7;46;165;1044;19;154;0,11;22,70;Cuba;"Editorial Ciencias Medicas";"Medicine (miscellaneous) (Q3)"
336;4700152850;"Revista Brasileira de Ensino de Fisica";journal;"18069126, 18061117";0,202;Q3;8;68;243;1590;48;236;0,20;23,38;Brazil;"Sociedade Brasileira de Fisica";"Education (Q3); Physics and Astronomy (miscellaneous) (Q4)"
337;19200157024;"Revista Latinoamericana de Psicopatologia Fundamental";journal;"14154714";0,201;Q4;6;51;165;982;15;137;0,07;19,25;Brazil;"Associacao Universitaria de Pesquisa em Psicopatologia Fundamental";"Clinical Psychology (Q4); Psychiatry and Mental Health (Q4)"
338;23432;"Journal of the Chilean Chemical Society";journal;"07179324, 07179707";0,201;Q3;25;90;315;3065;178;311;0,47;34,06;Chile;"Sociedad Chilena De Quimica";"Chemistry (miscellaneous) (Q3)"
339;21100223159;"Investigacion Operacional";journal;"02574306";0,200;Q4;4;53;83;1045;29;81;0,35;19,72;Cuba;"Universidad de La Habana";"Applied Mathematics (Q4); Numerical Analysis (Q4); Statistics and Probability (Q4)"
340;145503;"Agrociencia";journal;"14053195";0,200;Q3;18;63;212;2251;87;212;0,29;35,73;Mexico;"Colegio de Postgraduados";"Agronomy and Crop Science (Q3); Environmental Science (miscellaneous) (Q3); Animal Science and Zoology (Q4); Plant Science (Q4)"
341;7900153109;"Producao";journal;"01036513";0,200;Q3;11;22;209;865;79;207;0,29;39,32;Brazil;"Associacao Brasileira de Engenharia de Producao";"Industrial and Manufacturing Engineering (Q3)"
342;13900154722;"Opcion";journal;"10121587";0,199;Q3;3;50;868;1287;38;849;0,04;25,74;Venezuela;"Universidad del Zulia";"Arts and Humanities (miscellaneous) (Q3); Social Sciences (miscellaneous) (Q3)"
343;16698;"Revista Brasileira de Plantas Medicinais";journal;"15160572";0,199;Q3;21;0;364;0;186;350;0,39;0,00;Brazil;"Fundacao do Instituto de Biociencias";"Complementary and Alternative Medicine (Q3); Pharmacology (Q3)"
344;21100217204;"Boletin de Geologia";journal;"01200283";0,198;Q3;3;19;65;749;14;61;0,26;39,42;Colombia;"Universidad Industrial de Santander";"Earth and Planetary Sciences (miscellaneous) (Q3)"
345;21100407145;"Investigacion y Educacion en Enfermeria";journal;"22160280, 01205307";0,198;Q3;5;38;155;877;61;149;0,34;23,08;Colombia;"Facultad de Enfermeria de la Universidad de Antioquia";"Nursing (miscellaneous) (Q3)"
346;10800153304;"Revista Brasileira de Educacao Especial";journal;"14136538";0,197;Q3;8;44;135;1237;27;123;0,13;28,11;Brazil;"Universidade Metodista de Piracicaba";"Education (Q3)"
347;22476;"Informacion Tecnologica";journal;"07168756, 07180764";0,197;Q3;10;126;364;3804;154;348;0,45;30,19;Chile;"Centro de Informacion Tecnologica";"Energy (miscellaneous) (Q3); Food Science (Q3); Geotechnical Engineering and Engineering Geology (Q3); Industrial and Manufacturing Engineering (Q3); Strategy and Management (Q3); Computer Science Applications (Q4)"
348;59860;"Arquivos Brasileiros de Psicologia";journal;"01008692, 18095267";0,196;Q4;6;46;101;1543;15;92;0,15;33,54;Brazil;"Fundacao Getulio Vargas";"Psychology (miscellaneous) (Q4)"
349;21100244946;"Kepes";journal;"17947111";0,196;Q1;2;23;67;543;6;62;0,11;23,61;Colombia;"Departamento de Diseno Visual, Universidad de Caldas";"Visual Arts and Performing Arts (Q1)"
350;19900191880;"Bolema - Mathematics Education Bulletin";journal;"19804415, 0103636X";0,196;Q3;5;59;222;1738;28;207;0,14;29,46;Brazil;"BOLEMA Departamento de Matematica";"Education (Q3); Mathematics (miscellaneous) (Q4)"
351;5000157109;"Revista Cubana de Hematologia, Inmunologia y Hemoterapia";journal;"08640289, 15612996";0,196;Q4;7;26;167;712;66;131;0,48;27,38;Cuba;"Editorial Ciencias Medicas";"Hematology (Q4); Immunology (Q4); Immunology and Allergy (Q4)"
352;10600153355;"Acta Bioethica";journal;"07175906, 1726569X";0,196;Q4;6;37;115;1047;15;100;0,14;28,30;Chile;"OPS/OMS, Unidad de Bioetica";"Health Policy (Q4); Health (social science) (Q4)"
353;5600152954;"Convergencia";journal;"14051435";0,196;Q3;7;27;82;1237;24;82;0,38;45,81;Mexico;"Facultad de Ciencias Publicas y Administracion Publica de la Universidad Autonoma del Estado de Mexico";"Social Sciences (miscellaneous) (Q3)"
354;26787;"Boletin de Investigaciones Marinas y Costeras";journal;"01229761";0,195;Q3;12;20;60;972;23;60;0,35;48,60;Colombia;"Instituto de Investigaciones Marinas y Costeras ";"Water Science and Technology (Q3); Animal Science and Zoology (Q4); Aquatic Science (Q4); Oceanography (Q4)"
355;21100200401;"International Journal of Psychological Research";journal;"20112084, 20117922";0,195;Q4;7;13;58;526;27;52;0,54;40,46;Colombia;"Universidad de San Buenaventura";"Psychology (miscellaneous) (Q4)"
356;20059;"Caldasia";journal;"03665232";0,195;Q3;11;29;78;1146;27;78;0,33;39,52;Colombia;"Universidad Nacional de Colombia";"Agricultural and Biological Sciences (miscellaneous) (Q3)"
357;21100812853;"Journal of Physical Education (Maringa)";journal;"24482455";0,194;Q3;5;60;179;2090;64;179;0,28;34,83;Brazil;"Universidade Estadual de Maringa";"Education (Q3); Public Health, Environmental and Occupational Health (Q4)"
358;17660;"Archivos de Medicina Veterinaria";journal;"07176201, 0301732X";0,194;Q3;18;0;183;0;66;173;0,23;0,00;Chile;"Universidad Austral de Chile";"Veterinary (miscellaneous) (Q3)"
359;34097;"Archivos de Cardiologia de Mexico";journal;"14059940";0,193;Q3;15;69;191;1363;63;137;0,35;19,75;Mexico;"Instituto Nacional de Cardiologia Ignazio Chavez";"Cardiology and Cardiovascular Medicine (Q3)"
