Rank;Sourceid;Title;Type;Issn;SJR;SJR Best Quartile;H index;Total Docs. (2017);Total Docs. (3years);Total Refs.;Total Cites (3years);Citable Docs. (3years);Cites / Doc. (2years);Ref. / Doc.;Country;Publisher;Categories
477;25969;"Social and Economic Studies";journal;"00377651";0,148;Q3;5;8;54;412;5;50;0,05;51,50;Jamaica;"University of the West Indies";"Social Sciences (miscellaneous) (Q3); Economics and Econometrics (Q4)"
478;21100229263;"Juridicas";journal;"17942918";0,148;Q3;1;10;66;255;2;60;0,00;25,50;Colombia;"Universidad de Caldas";"Law (Q3)"
479;11500153302;"Coluna/ Columna";journal;"18081851";0,147;Q4;7;60;182;1451;40;182;0,20;24,18;Brazil;"Bevilaqua Publisher";"Neurology (clinical) (Q4); Orthopedics and Sports Medicine (Q4); Surgery (Q4)"
480;15100;"Revista Brasileira de Oftalmologia";journal;"00347280";0,147;Q4;10;73;268;1150;30;241;0,11;15,75;Brazil;"Sociedade Brasileira de Oftalmologia";"Ophthalmology (Q4); Surgery (Q4)"
481;21100432496;"Revista de Derecho Privado";journal;"23462442, 01234366";0,147;Q3;1;25;69;1036;2;68;0,03;41,44;Colombia;"Universidad Externado de Colombia";"Law (Q3)"
482;15543;"Biotecnologia Aplicada";journal;"10272852, 08644551";0,146;Q4;11;8;84;266;18;83;0,22;33,25;Cuba;"Elfos Scientiae";"Applied Microbiology and Biotechnology (Q4); Biotechnology (Q4)"
483;65755;"Acta Agronomica";journal;"01202812";0,146;Q4;5;109;181;2356;43;179;0,20;21,61;Colombia;"Universidad Nacional De Colombia";"Agronomy and Crop Science (Q4); Soil Science (Q4)"
484;20500195068;"Journal of Microwaves, Optoelectronics and Electromagnetic Applications";journal;"21791074";0,146;Q4;12;76;101;1518;68;100;0,83;19,97;Brazil;"Brazilian Microwave and Optoelectronics Society";"Electrical and Electronic Engineering (Q4)"
485;19200157102;"Revista de la Facultad de Agronomia";journal;"03787818";0,146;Q4;5;25;144;738;14;144;0,07;29,52;Venezuela;"Universidad del Zulia";"Agronomy and Crop Science (Q4); Animal Science and Zoology (Q4); Food Science (Q4); Plant Science (Q4)"
486;21100202735;"Revista Lasallista de Investigacion";journal;"17944449";0,146;Q3;4;42;139;1058;20;133;0,19;25,19;Colombia;"Corporacion Universitaria Lasallista";"Multidisciplinary (Q3)"
487;27654;"Boletin de la Asociacion Medica de Puerto Rico";journal;"00044849";0,146;Q4;12;0;133;0;37;133;0,28;0,00;Puerto Rico;"Associacion Medica de Puerto Rico";"Medicine (miscellaneous) (Q4)"
488;21100218035;"Revista de la Federacion Argentina de Cardiologia";journal;"16665694, 0326646X";0,146;Q4;4;45;158;508;9;131;0,06;11,29;Argentina;"Federacion Argentina de Cardiologia";"Cardiology and Cardiovascular Medicine (Q4)"
489;21100407629;"Revista Contabilidade e Financas";journal;"1808057X";0,145;Q4;1;20;64;760;11;55;0,20;38,00;Brazil;"Universidade De Sao Paulo";"Accounting (Q4); Finance (Q4)"
490;21100792502;"Trashumante";journal;"23229675, 23229381";0,145;Q2;2;16;64;487;5;57;0,11;30,44;Colombia;"Universidad de Antioquia";"History (Q2); Social Sciences (miscellaneous) (Q4)"
491;19900191821;"Acta Scientiae Veterinariae";journal;"16799216, 16780345";0,144;Q4;9;16;168;328;38;168;0,26;20,50;Brazil;"Universidade Federal do Rio Grande do Sul";"Veterinary (miscellaneous) (Q4)"
492;11200153556;"Espacios";journal;"07981015";0,144;Q3;6;1945;1712;50248;219;1712;0,12;25,83;Venezuela;"Sociacion de Profesionales y Tecnicos del CONICIT";"Business and International Management (Q3); Management of Technology and Innovation (Q4); Management Science and Operations Research (Q4)"
493;19300157111;"Revista Brasileira de Gestao de Negocios";journal;"19830807, 18064892";0,144;Q3;6;32;103;1969;37;103;0,31;61,53;Brazil;"Fundacao Escola de Comercio Alvares Penteado (FECAP)";"Business and International Management (Q3); Industrial Relations (Q4); Strategy and Management (Q4)"
494;19700186945;"Journal of Urban and Environmental Engineering";journal;"19823932";0,144;Q3;9;3;75;87;19;75;0,18;29,00;Brazil;"Universidade Federal da Parana";"Urban Studies (Q3); Environmental Engineering (Q4)"
495;4700152250;"Revista Brasileira de Ciencias Sociais";journal;"01026909";0,144;Q4;11;22;91;756;16;90;0,14;34,36;Brazil;"Associacao Nacional de Pos-Graduacao e Pesquisa em Ciencias Sociais";"Social Sciences (miscellaneous) (Q4)"
496;14784;"Historia, Ciencias, Saude - Manguinhos";journal;"01045970";0,144;Q3;15;71;320;2982;58;263;0,23;42,00;Brazil;"Fundacao Oswaldo Cruz";"History and Philosophy of Science (Q3); Medicine (miscellaneous) (Q4)"
497;21100316036;"Signo y Pensamiento";journal;"20272731, 01204823";0,143;Q3;1;18;41;887;7;40;0,15;49,28;Colombia;"Pontificia Universidad Javeriana";"Linguistics and Language (Q3); Communication (Q4)"
498;4700152478;"Jornal Brasileiro de Patologia e Medicina Laboratorial";journal;"16762444";0,143;Q4;12;66;198;1374;41;179;0,20;20,82;Brazil;"Sociedade Brasileira de Patologia Clinica";"Clinical Biochemistry (Q4); Medical Laboratory Technology (Q4); Pathology and Forensic Medicine (Q4)"
499;8000153137;"Zootecnia Tropical";journal;"07987269";0,143;Q4;8;0;73;0;11;71;0,13;0,00;Venezuela;"Fondo Nacional de Investigaciones Agropecuarias Venezuela";"Animal Science and Zoology (Q4); Aquatic Science (Q4)"
500;23044;"Revista Cubana de Medicina Tropical";journal;"03750760, 15613054";0,143;Q4;16;17;112;458;22;108;0,19;26,94;Cuba;"Editorial Ciencias Medicas";"Infectious Diseases (Q4); Parasitology (Q4)"
501;10600153356;"Acta Colombiana de Psicologia";journal;"01239155";0,143;Q4;9;28;89;1077;21;82;0,21;38,46;Colombia;"Universidad Catolica de Colombia";"Psychiatry and Mental Health (Q4); Psychology (miscellaneous) (Q4)"
502;21100265755;"Gaea";journal;"19833628";0,143;Q4;2;0;6;0;1;6;0,17;0,00;Brazil;"Universidade do Vale do Rio dos Sinos";"Earth and Planetary Sciences (miscellaneous) (Q4)"
503;17356;"Revista mexicana de sociologia";journal;"01882503";0,142;Q4;6;28;79;1266;25;79;0,21;45,21;Mexico;"Universidad Nacional Autonoma de Mexico";"Social Sciences (miscellaneous) (Q4); Sociology and Political Science (Q4)"
504;21100853577;"Escola Anna Nery Revista de Enfermagem";journal;"14148145";0,141;Q4;1;3;3;76;1;3;0,00;25,33;Brazil;"Escola de Enfermagem Anna Nery";"Nursing (miscellaneous) (Q4)"
505;19900192005;"Onomazein";journal;"07185758, 07171285";0,141;Q3;6;61;127;2410;25;124;0,13;39,51;Chile;"Pontificia Universidad Catolica de Chile";"Language and Linguistics (Q3); Linguistics and Language (Q3)"
506;20000195026;"Surgical and Cosmetic Dermatology";journal;"19848773, 19845510";0,141;Q4;8;68;221;914;31;211;0,12;13,44;Brazil;"Sociedade Brasileira de Dermatologia";"Dermatology (Q4); Surgery (Q4)"
507;5700167217;"Revista de Economia Institucional";journal;"01245996";0,141;Q4;5;34;118;925;10;88;0,13;27,21;Colombia;"La Facultad de Economia";"Economics, Econometrics and Finance (miscellaneous) (Q4)"
508;26808;"Estudios demograficos y urbanos";journal;"01867210";0,140;Q3;3;19;57;804;10;55;0,11;42,32;Mexico;"Colegio de Mexico, A.C.";"Urban Studies (Q3); Demography (Q4)"
509;21100450368;"Urbe";journal;"21753369";0,140;Q2;3;27;60;948;9;57;0,16;35,11;Brazil;"Editora Champagnat";"Architecture (Q2); Urban Studies (Q3); Geography, Planning and Development (Q4)"
510;19700181224;"Calidoscopio";journal;"21776202";0,140;Q3;2;51;139;1374;7;127;0,07;26,94;Brazil;"Unisinos";"Language and Linguistics (Q3); Linguistics and Language (Q3)"
511;21100447122;"Theologica Xaveriana";journal;"2011219X";0,140;Q2;1;20;35;804;4;32;0,13;40,20;Colombia;"Pontificia Universidad Javeriana";"Religious Studies (Q2)"
512;80685;"SBMO/IEEE MTT-S International Microwave and Optoelectronics Conference Proceedings";conference and proceedings;"-";0,139;-;15;0;196;0;76;195;0,39;0,00;Brazil;"";"Condensed Matter Physics; Electrical and Electronic Engineering"
513;9500154103;"Revista de Pedagogia";journal;"07989792";0,139;Q4;4;14;48;532;6;45;0,15;38,00;Venezuela;"Universidad Central de Venezuela";"Education (Q4)"
514;21951;"Revista Mexicana de Anestesiologia";journal;"01851012";0,139;Q3;6;54;417;1079;8;183;0,03;19,98;Mexico;"Sociedad Mexicana de Anestesiologia A.C.";"Anesthesiology and Pain Medicine (Q3)"
515;28164;"Revista Chilena de Obstetricia y Ginecologia";journal;"07177526, 0048766X";0,139;Q4;10;73;291;1336;36;276;0,16;18,30;Chile;"Sociedad Chilena de Obstetricia y Ginecologia";"Obstetrics and Gynecology (Q4)"
516;19900192604;"Adolescencia e Saude";journal;"21775281, 16799941";0,139;Q4;4;73;162;1386;9;148;0,06;18,99;Brazil;"Editorarte Projetos de Comunicacao e Editora";"Pediatrics, Perinatology and Child Health (Q4)"
517;27821;"Acta Gastroenterologica Latinoamericana";journal;"03009033";0,138;Q4;15;51;214;1046;30;169;0,16;20,51;Argentina;"Sociedad Argentina de Gastroenterologia";"Gastroenterology (Q4)"
518;145059;"CT y F - Ciencia, Tecnologia y Futuro";journal;"01225383";0,138;Q4;9;15;36;601;14;36;0,28;40,07;Colombia;"Ecopetrol";"Energy (miscellaneous) (Q4)"
519;21100798596;"Revista Facultad Nacional de Agronomia de Medellin";journal;"03042847, 22487026";0,138;Q4;1;16;12;503;3;10;0,30;31,44;Colombia;"Universidad Nacional De Colombia";"Agronomy and Crop Science (Q4); Animal Science and Zoology (Q4); Food Science (Q4); Forestry (Q4); Horticulture (Q4)"
520;22219;"Revista Cubana de Cirugia";journal;"15612945, 00347493";0,138;Q4;5;30;120;636;9;120;0,05;21,20;Cuba;"Ministerio de Salud Publica";"Surgery (Q4)"
521;5700160329;"Migraciones Internacionales";journal;"16658906";0,138;Q4;6;20;56;693;17;52;0,33;34,65;Mexico;"El Colegio de la Frontiera Norte";"Demography (Q4); Geography, Planning and Development (Q4)"
522;8100153108;"Revista Brasileira de Historia";journal;"01020188";0,138;Q2;5;28;91;875;12;83;0,07;31,25;Brazil;"Associacao Nacional dos Professores Universitarios de Historia, ANPUH";"Cultural Studies (Q2); History (Q2); Geography, Planning and Development (Q4); Sociology and Political Science (Q4)"
523;21100432126;"Revista Derecho del Estado";journal;"01229893, 23462051";0,138;Q4;1;16;43;492;4;43;0,09;30,75;Colombia;"Universidad Externado de Colombia";"Law (Q4)"
524;15600154702;"Alpha";journal;"07182201, 07164254";0,138;Q3;5;38;121;1065;16;94;0,13;28,03;Chile;"Universidad de Los Lagos";"Arts and Humanities (miscellaneous) (Q3)"
525;21100242601;"Brazilian Journal of Analytical Chemistry";journal;"21793433, 21793425";0,138;Q4;5;31;17;381;4;9;0,00;12,29;Brazil;"DKK Comunicacao";"Analytical Chemistry (Q4)"
526;19900193899;"Aquichan";journal;"16575997, 20275374";0,137;Q4;5;36;130;1164;28;118;0,12;32,33;Colombia;"Universidad de La Sabana";"Nursing (miscellaneous) (Q4)"
527;19264;"Revista Chilena de Neuro-Psiquiatria";journal;"00347388";0,137;Q4;11;31;106;889;14;84;0,14;28,68;Chile;"Sociedad Chilena de Neurologia psiquiatria y Neurocirugia";"Neurology (clinical) (Q4); Psychiatry and Mental Health (Q4); Surgery (Q4)"
528;19600157006;"BAR - Brazilian Administration Review";journal;"18077692";0,137;Q4;10;24;80;1299;24;69;0,24;54,13;Brazil;"Brazilian Administration Review";"Strategy and Management (Q4)"
529;53033;"Revista Medica del Instituto Mexicano del Seguro Social";journal;"04435117";0,136;Q4;12;0;497;0;94;435;0,23;0,00;Mexico;"Officina de Bibliotecas y Divulgacion de la Jefatura de los Servicios de Ensenanza e Investigacion";"Medicine (miscellaneous) (Q4)"
530;21100332207;"Revista Colombiana de Matematicas";journal;"23574100";0,136;Q4;3;13;47;255;13;47;0,22;19,62;Colombia;"Universidad Nacional De Colombia";"Mathematics (miscellaneous) (Q4)"
531;145494;"Jornal Vascular Brasileiro";journal;"16777301, 16775449";0,136;Q4;11;59;175;1297;36;159;0,25;21,98;Brazil;"Sociedade Brasileira de Angiologia e Cirurgia Vascular";"Cardiology and Cardiovascular Medicine (Q4)"
532;19900193218;"Revista Gerencia y Politicas de Salud";journal;"16577027";0,136;Q4;5;18;91;677;14;85;0,15;37,61;Colombia;"Pontificia Universidad Javeriana";"Health Policy (Q4)"
533;21100244898;"Antipoda";journal;"19005407, 20114273";0,135;Q2;2;36;90;1145;17;72;0,22;31,81;Colombia;"Universidad de los Andes";"Cultural Studies (Q2); Anthropology (Q3); Archeology (Q3); Archeology (arts and humanities) (Q3)"
534;19700175118;"Revista Mexicana de Neurociencia";journal;"16655044";0,135;Q4;4;0;49;0;7;46;0,00;0,00;Mexico;"Academia Mexicana de Neurologia";"Neurology (Q4); Neurology (clinical) (Q4); Neuropsychology and Physiological Psychology (Q4); Public Health, Environmental and Occupational Health (Q4)"
535;5600153115;"Tempo Social: Revista de Sociologia da USP";journal;"01032070";0,135;Q4;8;43;91;1878;19;89;0,14;43,67;Brazil;"Universidade de Sao Paulo";"Social Sciences (miscellaneous) (Q4)"
536;21100406340;"Medwave";journal;"07176384";0,134;Q4;2;43;312;0;54;266;0,21;0,00;Chile;"Medwave Estudios Limitada";"Medicine (miscellaneous) (Q4)"
537;21100228046;"America Latina en la Historia Economica";journal;"14052253";0,134;Q2;3;24;63;1164;9;63;0,12;48,50;Mexico;"Instituto de Investigaciones Dr. Jose Maria Luis Mora";"History (Q2); Economics, Econometrics and Finance (miscellaneous) (Q4)"
538;12100154802;"Soils and Rocks";journal;"19809743";0,133;Q4;7;17;41;426;8;41;0,14;25,06;Brazil;"Associacao Brasileira de Mecanica dos Solos";"Geotechnical Engineering and Engineering Geology (Q4)"
539;21100317205;"Infectio";journal;"01239392";0,133;Q4;5;35;107;911;27;91;0,26;26,03;Colombia;"Asociacion Colombiana de Infectologia";"Infectious Diseases (Q4); Microbiology (medical) (Q4); Pharmacology (medical) (Q4)"
540;14732;"Revista Mexicana de Psicologia";journal;"01856073";0,133;Q4;15;0;38;0;14;38;0,44;0,00;Mexico;"Sociedad Mexicana de Psicologia";"Psychology (miscellaneous) (Q4)"
541;5000157105;"DELTA Documentacao de Estudos em Linguistica Teorica e Aplicada";journal;"01024450";0,133;Q3;7;38;126;1138;29;122;0,22;29,95;Brazil;"Pontificia Universidade Catolica de Sao Paulo";"Linguistics and Language (Q3)"
542;18667;"Psiquiatria Biologica";journal;"01047787";0,133;Q4;5;27;94;843;9;84;0,11;31,22;Brazil;"Associacao Brasileira de Psiquiatria Biologica";"Psychiatry and Mental Health (Q4)"
543;73467;"RA'E GA - O Espaco Geografico em Analise";journal;"15164136";0,133;Q4;5;46;121;1432;7;113;0,09;31,13;Brazil;"Universidade Federal do Parana";"Geography, Planning and Development (Q4)"
544;19700171103;"Revista del Museo Argentino de Ciencias Naturales, Nueva Serie";journal;"15145158";0,132;Q4;11;6;49;202;12;49;0,27;33,67;Argentina;"Museo Argentino de Ciencias Naturales Bernardino Rivadavia e Instituto Nacional de Investigacion de las Ciencias Naturales";"Animal Science and Zoology (Q4); Ecology, Evolution, Behavior and Systematics (Q4); Paleontology (Q4)"
545;21100395706;"Revista de Investigaciones Agropecuarias";journal;"03258718, 16692314";0,132;Q4;2;38;128;908;12;114;0,09;23,89;Argentina;"Instituto Nacional de Tecnologia Agropecuaria";"Agronomy and Crop Science (Q4); Horticulture (Q4); Plant Science (Q4); Soil Science (Q4)"
546;6400153148;"Investigacion Economica";journal;"01851667";0,132;Q4;6;21;70;660;17;60;0,38;31,43;Mexico;"Universidad Nacional Autonoma de Mexico";"Economics, Econometrics and Finance (miscellaneous) (Q4)"
547;21100205757;"Superficies y Vacio";journal;"16653521";0,132;Q4;5;0;44;0;13;44;0,25;0,00;Mexico;"Mexican Society on Science and Technology of Surfaces and Materials";"Surfaces, Coatings and Films (Q4)"
548;21100218527;"AUS";journal;"07187262, 0718204X";0,132;Q3;3;11;80;152;11;70;0,02;13,82;Chile;"Universidad Austral de Chile";"Architecture (Q3); Urban Studies (Q3)"
549;4700151917;"Revista Escola de Minas";journal;"03704467";0,132;Q4;11;2;143;45;28;131;0,13;22,50;Brazil;"Escola de minas";"Economic Geology (Q4); Geochemistry and Petrology (Q4); Geology (Q4); Materials Science (miscellaneous) (Q4); Waste Management and Disposal (Q4)"
550;12000154490;"Agora";journal;"18094414, 15161498";0,132;Q4;2;39;97;854;7;92;0,06;21,90;Brazil;"Universidade Federal do Rio de Janeiro";"Psychiatry and Mental Health (Q4); Psychology (miscellaneous) (Q4)"
551;7400153104;"Brazilian Journal of Oral Sciences";journal;"16773225";0,131;Q4;8;0;157;0;33;156;0,16;0,00;Brazil;"Universidade Estadual de Campinas";"Dentistry (miscellaneous) (Q4)"
552;4700152283;"Revista de Ciencias Farmaceuticas Basica e Aplicada";journal;"18084532";0,131;Q3;13;143;136;95;29;136;0,06;0,66;Brazil;"Universidade Estadual Paulista (UNESP)";"Pharmaceutical Science (Q3)"
553;5800207596;"Linguistica";journal;"11320214, 2079312X";0,130;Q3;2;16;53;527;5;46;0,10;32,94;Uruguay;"Asociación de Lingüistica y Filología de la América Latina";"Language and Linguistics (Q3); Linguistics and Language (Q3); Artificial Intelligence (Q4)"
554;25679;"Historia Mexicana";journal;"01850172";0,130;Q2;8;39;90;2140;4;80;0,04;54,87;Mexico;"Colegio de Mexico, A.C.";"History (Q2)"
555;5800207800;"Literatura y Linguistica";journal;"07165811";0,130;Q2;4;41;116;1126;11;109;0,12;27,46;Chile;"Instituto Profesional de Estudios Superiores Blas Canas";"Literature and Literary Theory (Q2); Language and Linguistics (Q3); Linguistics and Language (Q3)"
556;13562;"Revista Cubana de Investigaciones Biomedicas";journal;"08640300, 15613011";0,130;Q4;8;20;111;568;17;111;0,13;28,40;Cuba;"Editorial Ciencias Medicas";"Medicine (miscellaneous) (Q4)"
557;18955;"Revista Cientifica de la Facultad de Ciencias Veterinarias de la Universidad del Zulia";journal;"07982259";0,129;Q4;10;50;145;1612;14;145;0,09;32,24;Venezuela;"Universidad del Zulia";"Veterinary (miscellaneous) (Q4)"
558;18800156704;"Journal of Science Education";journal;"01245481";0,129;Q4;3;29;75;643;6;70;0,06;22,17;Colombia;"Journal of Science Education";"Education (Q4)"
559;21100855893;"Revista Brasileira de Medicina Veterinaria";journal;"01002430, 25272179";0,129;Q4;5;0;326;0;28;326;0,05;0,00;Brazil;"Society of Veterinary Medicine of Rio de Janeiro";"Veterinary (miscellaneous) (Q4)"
560;21100227000;"Tzintzun";journal;"1870719X";0,129;Q2;1;12;61;703;2;59;0,05;58,58;Mexico;"Universidad Michoacana de San Nicolas de Hidalgo";"History (Q2)"
561;23495;"Revista Cubana de Estomatologia";journal;"00347507, 1561297X";0,128;Q4;6;45;135;973;23;126;0,16;21,62;Cuba;"Editorial Ciencias Medicas";"Dentistry (miscellaneous) (Q4)"
562;4700152605;"Psicologia: Teoria e Pesquisa";journal;"01023772";0,128;Q4;16;10;181;398;42;179;0,19;39,80;Brazil;"Departamento de Psicologia, Universidade de Brasilia";"Psychology (miscellaneous) (Q4)"
563;21100224425;"Informacion, Cultura y Sociedad";journal;"18511740, 15148327";0,128;Q4;2;20;47;505;6;40;0,11;25,25;Argentina;"Instituto de Investigaciones Bibliotecologicas";"Library and Information Sciences (Q4)"
564;145512;"Acta Scientiarum - Health Sciences";journal;"16799291";0,128;Q4;10;30;100;899;17;100;0,15;29,97;Brazil;"Universidade Estadual de Maringa";"Biochemistry, Genetics and Molecular Biology (miscellaneous) (Q4); Medicine (miscellaneous) (Q4)"
565;21100222547;"Latin American Journal of Economics";journal;"07190425, 07190433";0,127;Q4;10;0;25;0;8;25;0,14;0,00;Chile;"Pontificia Universidad Catolica de Chile";"Economics, Econometrics and Finance (miscellaneous) (Q4)"
566;5100152903;"Revista Cubana de Plantas Medicinales";journal;"10284796";0,127;Q4;10;16;133;442;19;129;0,10;27,63;Cuba;"Editorial Ciencias Medicas";"Drug Discovery (Q4); Pharmacology (Q4); Plant Science (Q4)"
567;5600153133;"Sociedade e Estado";journal;"01026992, 19805462";0,127;Q4;9;34;146;1291;18;116;0,06;37,97;Brazil;"Editora Universidade de Brasilia";"Geography, Planning and Development (Q4); Sociology and Political Science (Q4)"
568;21100197363;"Revista Virtual de Quimica";journal;"19846835";0,127;Q4;8;158;413;7843;90;395;0,20;49,64;Brazil;"Secretaria Regional do Rio de Janeiro da Sociedade Brasileira de Quimica";"Chemistry (miscellaneous) (Q4); Mathematics (miscellaneous) (Q4)"
569;21100824861;"Revista Colombiana de Reumatologia";journal;"01218123, 20279000";0,127;Q4;5;44;119;1046;14;102;0,13;23,77;Colombia;"Asociacion Colombiana de Reumatologia";"Rheumatology (Q4)"
570;7500153124;"Revista Ciencias de la Salud";journal;"16927273";0,127;Q4;5;33;129;1070;26;119;0,13;32,42;Colombia;"Universidad del Rosario, Escuela de Ciencias de la Salud";"Health Policy (Q4); Health (social science) (Q4); Medicine (miscellaneous) (Q4)"
571;14377;"Estudios Sociologicos";journal;"01854186";0,126;Q4;2;5;40;196;7;40;0,29;39,20;Mexico;"Centro de Estudios Sociologicos de El Colegio de Mexico";"Political Science and International Relations (Q4); Sociology and Political Science (Q4)"
572;7200153148;"Revista Brasileira de Gestao e Desenvolvimento Regional";journal;"1809239X";0,126;Q4;4;52;177;1590;13;166;0,05;30,58;Brazil;"Universidade de Taubate";"Environmental Science (miscellaneous) (Q4); Geography, Planning and Development (Q4); Sociology and Political Science (Q4); Urban Studies (Q4)"
573;12147;"Lundiana";journal;"16766180";0,126;Q4;17;0;6;0;1;6;0,17;0,00;Brazil;"Universidade Federal de Minas Gerais";"Ecology (Q4); Ecology, Evolution, Behavior and Systematics (Q4)"
574;20274;"Revista de la Facultad de Ciencias Medicas de Cordoba";journal;"00146722";0,126;Q4;8;0;116;0;20;107;0,13;0,00;Argentina;"Universidad Nacional de Cordoba";"Medicine (miscellaneous) (Q4)"
575;21100778010;"Journal of Oral Research";journal;"07192479";0,126;Q4;3;95;68;1006;20;37;0,54;10,59;Chile;"Universidad de Concepcion";"Dentistry (miscellaneous) (Q4)"
576;20000195064;"Taller de Letras";journal;"07160798";0,126;Q2;2;21;79;373;3;72;0,05;17,76;Chile;"Pontificia Universidad Catolica de Chile";"Literature and Literary Theory (Q2)"
577;21100225018;"Ilha do Desterro";journal;"01014846";0,125;Q2;4;51;102;1580;11;97;0,14;30,98;Brazil;"Universidade Federal de Santa Catarina";"Literature and Literary Theory (Q2)"
578;37267;"Cuban Journal of Agricultural Science";journal;"08640408";0,125;Q4;10;0;170;0;22;163;0,13;0,00;Cuba;"Instituto de Ciencia Animal";"Animal Science and Zoology (Q4)"
579;20265;"Revista de la Facultad de Medicina";journal;"01200011";0,125;Q4;5;131;327;4606;45;301;0,14;35,16;Colombia;"Universidad Nacional de Colombia";"Medicine (miscellaneous) (Q4)"
580;21100200412;"Revista Mexicana de Ingenieria Biomedica";journal;"01889532";0,125;Q4;4;55;69;1231;12;59;0,19;22,38;Mexico;"Sociedad Mexicana de Ingenieria Biomedica";"Biomedical Engineering (Q4)"
581;18364;"Medicina";journal;"00766046, 21767262";0,125;Q4;9;60;185;1462;20;179;0,09;24,37;Brazil;"Universidade de Sao Paulo";"Medicine (miscellaneous) (Q4)"
582;21100455599;"2015 Americas Conference on Information Systems, AMCIS 2015";conference and proceedings;"-";0,125;-;5;0;465;0;102;463;0,22;0,00;Puerto Rico;"";"Artificial Intelligence; Mechanical Engineering"
583;63853;"Revista Cubana de Higiene y Epidemiologia";journal;"02531151";0,124;Q4;8;0;62;0;12;56;0,05;0,00;Cuba;"Ministerio de Salud Publica";"Epidemiology (Q4); Public Health, Environmental and Occupational Health (Q4)"
584;28167;"Revista Colombiana de Obstetricia y Ginecologia";journal;"00347434";0,124;Q4;6;22;118;682;13;89;0,05;31,00;Colombia;"Sociedad Colombiana De Obstetricia y Ginecologia";"Obstetrics and Gynecology (Q4)"
585;21100812388;"Revista Criminalidad";journal;"22565531, 17943108";0,124;Q3;1;10;30;423;2;27;0,07;42,30;Colombia;"Policia Nacional de Colombia";"Arts and Humanities (miscellaneous) (Q3); Law (Q4); Social Psychology (Q4); Social Sciences (miscellaneous) (Q4); Sociology and Political Science (Q4)"
586;19900191832;"Ideas y Valores";journal;"01200062";0,124;Q3;3;60;131;1638;9;119;0,11;27,30;Colombia;"Universidad Nacional de Colombia";"Philosophy (Q3)"
587;21100227422;"Revista da Abordagem Gestaltica";journal;"18096867";0,124;Q4;2;37;82;861;6;76;0,02;23,27;Brazil;"Institute for Research and Training in Gestalt therapy Goiania";"Social Psychology (Q4); Sociology and Political Science (Q4)"
588;5000155404;"Revista Chilena de Radiologia";journal;"07179308, 0717201X";0,124;Q4;5;26;104;460;5;76;0,08;17,69;Chile;"Publimpacto";"Radiology, Nuclear Medicine and Imaging (Q4)"
589;17500155107;"Kasmera";journal;"00755222";0,123;Q4;5;14;42;334;2;37;0,04;23,86;Venezuela;"Universidad del Zulia";"Infectious Diseases (Q4); Microbiology (medical) (Q4)"
590;5100155067;"Revista de Estudios Historico-Juridicos";journal;"07165455";0,123;Q3;4;15;60;685;4;60;0,10;45,67;Chile;"Pontificia Universidad Católica de Valparaíso";"History (Q3); Law (Q4)"
591;19700188315;"Insuficiencia Cardiaca";journal;"18501044";0,123;Q4;4;25;79;721;3;69;0,04;28,84;Argentina;"Silver Horse S.R.L.";"Cardiology and Cardiovascular Medicine (Q4)"
592;28169;"Revista de Obstetricia y Ginecologia de Venezuela";journal;"00487732";0,123;Q4;6;30;108;788;8;99;0,10;26,27;Venezuela;"Sociedad de Obstetricia y Ginecologia de Venezuela";"Obstetrics and Gynecology (Q4)"
593;18499;"Revista del Instituto Nacional de Enfermedades Respiratorias";journal;"01877585";0,123;Q4;8;29;95;683;5;76;0,10;23,55;Mexico;"Instituto National De Enfermedades Respiratorias";"Pulmonary and Respiratory Medicine (Q4)"
594;4800156105;"Anales des la Asociacion Quimica Argentina";journal;"03650375";0,123;Q4;13;0;147;0;0;1;0,00;0,00;Argentina;"Asociacion Quimica Argentina";"Chemistry (miscellaneous) (Q4)"
595;130174;"Brazilian Journal of Plant Physiology";journal;"16770420";0,123;Q4;40;0;1;0;0;1;0,00;0,00;Brazil;"Brazilian Society of Plant Physiology";"Agronomy and Crop Science (Q4); Plant Science (Q4)"
596;12988;"Perinatologia y reproduccion humana / INPer";journal;"01875337";0,123;Q4;0;0;1;0;0;1;0,00;0,00;Mexico;"Instituto Nacional de Perinatologia";"Obstetrics and Gynecology (Q4); Pediatrics, Perinatology and Child Health (Q4)"
597;19700183029;"Historia Unisinos";journal;"15193861";0,123;Q3;2;37;125;1602;9;116;0,06;43,30;Brazil;"Universidade do Vale do Rio dos Sinos (UNISINOS)";"History (Q3)"
598;23554;"Problemas del Desarrollo";journal;"03017036, 20078951";0,123;Q4;4;32;117;978;23;101;0,23;30,56;Mexico;"Instituto de Investigaciones Economicas, UNAM";"Development (Q4); Economics and Econometrics (Q4)"
599;19900191816;"Revista de Filosofia: Aurora";journal;"19805934, 01044443";0,123;Q3;1;17;134;298;4;126;0,01;17,53;Brazil;"Pontificia Universidade Catolica Parana";"Philosophy (Q3)"
